{
  "id": "warding-wind",
  "tier": 2,
  "cast": {
    "mode": "instant",
    "cooldown": "medium",
    "cost": {
      "resource": "mana",
      "amount": "moderate"
    },
    "interruptible": true,
    "moveWhileCasting": false
  },
  "delivery": {
    "type": "self"
  },
  "clauses": [
    {
      "verb": "shield",
      "share": 0.45,
      "duration": "medium"
    },
    {
      "verb": "displace",
      "subject": "caster",
      "mode": "dash",
      "distance": "small"
    },
    {
      "verb": "modifyStat",
      "stat": "evasion",
      "share": 0.3,
      "direction": "buff",
      "duration": "medium"
    },
    {
      "verb": "modifyStat",
      "stat": "critChance",
      "share": 0.25,
      "direction": "buff",
      "duration": "medium"
    }
  ]
}