[
  {
    "id": "stone-bulwark",
    "tier": 2,
    "cast": {
      "mode": "instant",
      "cooldown": "medium",
      "cost": {
        "resource": "mana",
        "amount": "low"
      },
      "interruptible": true,
      "moveWhileCasting": false
    },
    "delivery": {
      "type": "self"
    },
    "clauses": [
      {
        "verb": "shield",
        "element": "earth",
        "share": 0.7,
        "duration": "medium"
      },
      {
        "verb": "modifyStat",
        "stat": "armor",
        "direction": "buff",
        "share": 0.3,
        "duration": "medium"
      }
    ]
  },
  {
    "id": "tremor-slam",
    "tier": 2,
    "cast": {
      "mode": "cast",
      "castTime": "normal",
      "cooldown": "long",
      "cost": {
        "resource": "mana",
        "amount": "moderate"
      },
      "interruptible": true,
      "moveWhileCasting": false
    },
    "delivery": {
      "type": "groundAoE",
      "shape": "circle",
      "size": "medium"
    },
    "clauses": [
      {
        "verb": "damage",
        "element": "earth",
        "share": 0.5
      },
      {
        "verb": "applyStatus",
        "status": "root",
        "duration": "short",
        "share": 0.3
      },
      {
        "verb": "modifyStat",
        "stat": "moveSpeed",
        "direction": "debuff",
        "share": 0.2,
        "duration": "short"
      }
    ]
  },
  {
    "id": "earthen-ward-field",
    "tier": 2,
    "cast": {
      "mode": "cast",
      "castTime": "long",
      "cooldown": "long",
      "cost": {
        "resource": "mana",
        "amount": "high"
      },
      "interruptible": true,
      "moveWhileCasting": false
    },
    "delivery": {
      "type": "groundAoE",
      "shape": "circle",
      "size": "large"
    },
    "clauses": [
      {
        "verb": "spawnZone",
        "shape": "circle",
        "size": "large",
        "duration": "long",
        "tickInterval": "slow",
        "affects": "allies",
        "tickClauses": [
          {
            "verb": "applyStatus",
            "status": "regen",
            "duration": "short",
            "share": 0.5
          },
          {
            "verb": "modifyStat",
            "stat": "damageIn",
            "direction": "debuff",
            "share": 0.5,
            "duration": "short"
          }
        ]
      }
    ]
  }
]