{
  "id": "smoke",
  "tier": 2,
  "cast": {
    "mode": "cast",
    "castTime": "quick",
    "cooldown": "medium",
    "cost": {
      "resource": "mana",
      "amount": "moderate"
    },
    "interruptible": true,
    "moveWhileCasting": false
  },
  "delivery": {
    "type": "groundAoE",
    "shape": "circle",
    "size": "large"
  },
  "clauses": [
    {
      "verb": "spawnZone",
      "shape": "circle",
      "size": "large",
      "duration": "medium",
      "tickInterval": "medium",
      "affects": "enemies",
      "tickClauses": [
        {
          "verb": "damage",
          "element": "shadow",
          "share": 0.35
        },
        {
          "verb": "applyStatus",
          "status": "blind",
          "duration": "short",
          "share": 0.40
        }
      ]
    },
    {
      "verb": "applyStatus",
      "status": "slow",
      "duration": "medium",
      "share": 0.25
    }
  ]
}