{
  "id": "riverstone",
  "tier": 2,
  "cast": {
    "mode": "cast",
    "castTime": "normal",
    "cooldown": "medium",
    "cost": {
      "resource": "mana",
      "amount": "moderate"
    },
    "interruptible": true,
    "moveWhileCasting": false
  },
  "delivery": {
    "type": "self"
  },
  "clauses": [
    {
      "verb": "shield",
      "share": 0.55,
      "duration": "long"
    },
    {
      "verb": "applyStatus",
      "status": "regen",
      "share": 0.45,
      "duration": "long"
    }
  ]
}