{
  "id": "murk",
  "tier": 2,
  "cast": {
    "mode": "instant",
    "cooldown": "medium",
    "cost": {
      "resource": "mana",
      "amount": "moderate"
    },
    "interruptible": true,
    "moveWhileCasting": false
  },
  "delivery": {
    "type": "groundAoE",
    "shape": "circle",
    "size": "medium"
  },
  "clauses": [
    {
      "verb": "applyStatus",
      "status": "blind",
      "duration": "medium",
      "share": 0.55
    },
    {
      "verb": "displace",
      "subject": "target",
      "mode": "push",
      "distance": "small"
    },
    {
      "verb": "modifyStat",
      "stat": "moveSpeed",
      "direction": "debuff",
      "share": 0.25,
      "duration": "medium"
    }
  ]
}