{
  "id": "conflagration",
  "tier": 3,
  "cast": {
    "mode": "cast",
    "castTime": "normal",
    "cooldown": "long",
    "cost": {
      "resource": "mana",
      "amount": "high"
    },
    "interruptible": true,
    "moveWhileCasting": false
  },
  "delivery": {
    "type": "groundAoE",
    "shape": "circle",
    "size": "large"
  },
  "clauses": [
    {
      "verb": "damage",
      "element": "fire",
      "share": 0.35,
      "template": {
        "kind": "ifStatus",
        "status": "burn",
        "consume": false,
        "amplify": "major"
      }
    },
    {
      "verb": "applyStatus",
      "status": "burn",
      "duration": "medium",
      "share": 0.15
    },
    {
      "verb": "displace",
      "subject": "target",
      "mode": "push",
      "distance": "medium"
    },
    {
      "verb": "spawnZone",
      "shape": "circle",
      "size": "large",
      "duration": "medium",
      "tickInterval": "medium",
      "affects": "enemies",
      "tickClauses": [
        {
          "verb": "damage",
          "element": "fire",
          "share": 0.2,
          "template": {
            "kind": "ifStatus",
            "status": "burn",
            "consume": false,
            "amplify": "minor"
          }
        },
        {
          "verb": "applyStatus",
          "status": "burn",
          "duration": "short",
          "share": 0.1
        },
        {
          "verb": "displace",
          "subject": "target",
          "mode": "push",
          "distance": "small"
        }
      ]
    }
  ]
}