{
  "id": "seagrass",
  "tier": 2,
  "cast": {
    "mode": "cast",
    "castTime": "quick",
    "cooldown": "medium",
    "cost": {
      "resource": "mana",
      "amount": "moderate"
    },
    "interruptible": true,
    "moveWhileCasting": false
  },
  "delivery": {
    "type": "groundAoE",
    "shape": "circle",
    "size": "medium"
  },
  "clauses": [
    {
      "verb": "applyStatus",
      "status": "root",
      "duration": "long",
      "share": 0.6
    },
    {
      "verb": "modifyStat",
      "stat": "moveSpeed",
      "direction": "debuff",
      "share": 0.4,
      "duration": "long"
    }
  ]
}